{
  "jurisdictions": [
    { "id": "federal", "name": "Federal" },
    { "id": "state", "name": "State" },
    { "id": "local", "name": "Local (City / County)" }
  ],
  "categories": [
    { "id": "food", "name": "Food & Beverage" },
    { "id": "retail", "name": "Retail & Services" },
    { "id": "health", "name": "Health & Wellness" },
    { "id": "childcare", "name": "Childcare & Education" },
    { "id": "trades", "name": "Construction Trades" },
    { "id": "profsvc", "name": "Professional Services" },
    { "id": "transport", "name": "Transportation" },
    { "id": "animal", "name": "Animal Services" },
    { "id": "specialty", "name": "Specialty & Regulated" },
    { "id": "proflic", "name": "Professional & Occupational Licensing" },
    { "id": "bldg", "name": "Building & Construction Projects" },
    { "id": "landuse", "name": "Land Use & Development" },
    { "id": "events", "name": "Events & Temporary Permits" },
    { "id": "housing", "name": "Residential & Housing" },
    { "id": "envag", "name": "Environmental & Agriculture" }
  ],
  "plcNodes": [
    { "id": "ein", "name": "EIN Registration", "jurisdiction": "federal" },
    { "id": "fed_tax", "name": "Federal Tax Filing", "jurisdiction": "federal" },
    { "id": "fda", "name": "FDA Registration", "jurisdiction": "federal" },
    { "id": "atf", "name": "ATF License", "jurisdiction": "federal" },
    { "id": "ttb", "name": "TTB Alcohol Permit", "jurisdiction": "federal" },
    { "id": "fcc", "name": "FCC License", "jurisdiction": "federal" },
    { "id": "dot", "name": "DOT / FMCSA Authority", "jurisdiction": "federal" },
    { "id": "dea", "name": "DEA Registration", "jurisdiction": "federal" },
    { "id": "faa", "name": "FAA Certification", "jurisdiction": "federal" },
    { "id": "epa", "name": "EPA Permit", "jurisdiction": "federal" },
    { "id": "usda", "name": "USDA License", "jurisdiction": "federal" },
    { "id": "bg_check", "name": "Federal Background Check", "jurisdiction": "federal" },
    { "id": "wetlands", "name": "Wetlands Permit (USACE)", "jurisdiction": "federal" },
    { "id": "biz_reg", "name": "Business Registration", "jurisdiction": "state" },
    { "id": "state_tax", "name": "State Tax Registration", "jurisdiction": "state" },
    { "id": "sales_tax", "name": "Sales & Use Tax", "jurisdiction": "state" },
    { "id": "prof_lic", "name": "Professional License", "jurisdiction": "state" },
    { "id": "contr_lic", "name": "Contractor License", "jurisdiction": "state" },
    { "id": "state_health", "name": "Health Dept License", "jurisdiction": "state" },
    { "id": "liquor", "name": "Liquor License", "jurisdiction": "state" },
    { "id": "state_env", "name": "Environmental Permit", "jurisdiction": "state" },
    { "id": "workers_comp", "name": "Workers\u2019 Comp", "jurisdiction": "state" },
    { "id": "pharmacy_lic", "name": "Pharmacy License", "jurisdiction": "state" },
    { "id": "childcare", "name": "Childcare License", "jurisdiction": "state" },
    { "id": "motor", "name": "Motor Carrier Permit", "jurisdiction": "state" },
    { "id": "cannabis", "name": "Cannabis License", "jurisdiction": "state" },
    { "id": "insurance", "name": "Insurance License", "jurisdiction": "state" },
    { "id": "real_estate", "name": "Real Estate License", "jurisdiction": "state" },
    { "id": "fire_marshal", "name": "Fire Marshal Approval", "jurisdiction": "state" },
    { "id": "liability_ins", "name": "Liability Insurance", "jurisdiction": "state" },
    { "id": "env_review", "name": "Environmental Review", "jurisdiction": "state" },
    { "id": "water_rights", "name": "Water Rights Permit", "jurisdiction": "state" },
    { "id": "timber", "name": "Timber Harvest Permit", "jurisdiction": "state" },
    { "id": "agriculture", "name": "Agricultural Permit", "jurisdiction": "state" },
    { "id": "mining", "name": "Mining Permit", "jurisdiction": "state" },
    { "id": "foster_care", "name": "Foster Care License", "jurisdiction": "state" },
    { "id": "biz_license", "name": "Business License", "jurisdiction": "local" },
    { "id": "zoning", "name": "Zoning Approval", "jurisdiction": "local" },
    { "id": "building", "name": "Building Permit", "jurisdiction": "local" },
    { "id": "cert_occ", "name": "Certificate of Occupancy", "jurisdiction": "local" },
    { "id": "fire_insp", "name": "Fire Inspection", "jurisdiction": "local" },
    { "id": "health_insp", "name": "Health Inspection", "jurisdiction": "local" },
    { "id": "signage", "name": "Signage Permit", "jurisdiction": "local" },
    { "id": "special_use", "name": "Special Use Permit", "jurisdiction": "local" },
    { "id": "home_occ", "name": "Home Occupation Permit", "jurisdiction": "local" },
    { "id": "entertain", "name": "Entertainment License", "jurisdiction": "local" },
    { "id": "demolition", "name": "Demolition Permit", "jurisdiction": "local" },
    { "id": "grading", "name": "Grading / Excavation", "jurisdiction": "local" },
    { "id": "stormwater", "name": "Stormwater Permit", "jurisdiction": "local" },
    { "id": "historic", "name": "Historic Preservation Review", "jurisdiction": "local" },
    { "id": "elec_permit", "name": "Electrical Permit", "jurisdiction": "local" },
    { "id": "plumb_permit", "name": "Plumbing Permit", "jurisdiction": "local" },
    { "id": "event_permit", "name": "Event Permit", "jurisdiction": "local" },
    { "id": "film_permit", "name": "Film / Photo Permit", "jurisdiction": "local" },
    { "id": "rental_reg", "name": "Rental Registration", "jurisdiction": "local" },
    { "id": "str_license", "name": "Short-Term Rental License", "jurisdiction": "local" },
    { "id": "housing_insp", "name": "Housing Inspection", "jurisdiction": "local" },
    { "id": "street_close", "name": "Street Closure Permit", "jurisdiction": "local" }
  ],
  "journeys": [
    { "id": "restaurant", "name": "Open a Restaurant", "cat": "food", "steps": ["ein","fed_tax","biz_reg","state_tax","sales_tax","state_health","liquor","zoning","building","fire_insp","health_insp","biz_license","signage"] },
    { "id": "food_truck", "name": "Open a Food Truck", "cat": "food", "steps": ["ein","fed_tax","biz_reg","state_tax","sales_tax","state_health","health_insp","biz_license","special_use"] },
    { "id": "bar", "name": "Open a Bar / Nightclub", "cat": "food", "steps": ["ein","fed_tax","biz_reg","state_tax","sales_tax","liquor","fire_marshal","entertain","zoning","building","fire_insp","biz_license","signage"] },
    { "id": "bakery", "name": "Open a Bakery", "cat": "food", "steps": ["ein","fed_tax","fda","biz_reg","state_tax","sales_tax","state_health","zoning","building","health_insp","biz_license"] },
    { "id": "catering", "name": "Start a Catering Business", "cat": "food", "steps": ["ein","fed_tax","biz_reg","state_tax","sales_tax","state_health","health_insp","biz_license"] },
    { "id": "brewery", "name": "Start a Brewery", "cat": "food", "steps": ["ein","fed_tax","ttb","biz_reg","state_tax","liquor","state_env","zoning","building","biz_license"] },
    { "id": "coffee", "name": "Open a Coffee Shop", "cat": "food", "steps": ["ein","fed_tax","biz_reg","state_tax","sales_tax","state_health","zoning","health_insp","biz_license","signage"] },
    { "id": "winery", "name": "Start a Winery", "cat": "food", "steps": ["ein","fed_tax","ttb","usda","biz_reg","state_tax","liquor","zoning","biz_license"] },
    { "id": "retail", "name": "Open a Retail Store", "cat": "retail", "steps": ["ein","fed_tax","biz_reg","state_tax","sales_tax","zoning","building","biz_license","signage"] },
    { "id": "salon", "name": "Open a Hair Salon", "cat": "retail", "steps": ["ein","fed_tax","biz_reg","state_tax","prof_lic","zoning","health_insp","biz_license"] },
    { "id": "barbershop", "name": "Open a Barbershop", "cat": "retail", "steps": ["ein","fed_tax","biz_reg","state_tax","prof_lic","zoning","health_insp","biz_license"] },
    { "id": "tattoo", "name": "Open a Tattoo Parlor", "cat": "retail", "steps": ["ein","fed_tax","biz_reg","state_tax","prof_lic","state_health","zoning","health_insp","biz_license"] },
    { "id": "dryclean", "name": "Start a Dry Cleaner", "cat": "retail", "steps": ["ein","fed_tax","epa","biz_reg","state_tax","state_env","zoning","biz_license"] },
    { "id": "pawnshop", "name": "Open a Pawn Shop", "cat": "retail", "steps": ["ein","fed_tax","atf","biz_reg","state_tax","sales_tax","special_use","biz_license"] },
    { "id": "autorepair", "name": "Start an Auto Repair Shop", "cat": "retail", "steps": ["ein","fed_tax","epa","biz_reg","state_tax","state_env","zoning","biz_license"] },
    { "id": "pharmacy_j", "name": "Open a Pharmacy", "cat": "health", "steps": ["ein","fed_tax","dea","biz_reg","state_tax","pharmacy_lic","zoning","biz_license"] },
    { "id": "dental", "name": "Start a Dental Practice", "cat": "health", "steps": ["ein","fed_tax","biz_reg","state_tax","prof_lic","zoning","building","biz_license"] },
    { "id": "medical", "name": "Open a Medical Practice", "cat": "health", "steps": ["ein","fed_tax","dea","biz_reg","state_tax","prof_lic","zoning","building","biz_license"] },
    { "id": "homehealth", "name": "Start a Home Health Agency", "cat": "health", "steps": ["ein","fed_tax","biz_reg","state_tax","state_health","workers_comp","biz_license"] },
    { "id": "gym", "name": "Open a Gym / Fitness Center", "cat": "health", "steps": ["ein","fed_tax","biz_reg","state_tax","sales_tax","zoning","building","cert_occ","fire_insp","biz_license"] },
    { "id": "massage", "name": "Start a Massage Practice", "cat": "health", "steps": ["ein","fed_tax","biz_reg","state_tax","prof_lic","zoning","biz_license"] },
    { "id": "daycare", "name": "Open a Daycare Center", "cat": "childcare", "steps": ["ein","fed_tax","biz_reg","state_tax","childcare","fire_marshal","zoning","building","cert_occ","fire_insp","biz_license"] },